id,text
1,ブランドの世界観がファンを形成している。
2,ブランドストーリーが共感を呼んでいる。
3,口コミでの推奨が新規顧客獲得につながっている。
4,新製品の購買意欲が高まった理由は価格と品質のバランスが良いからだ。
5,オンライン購入後の受け取り方法がわかりにくい。
6,プロモーション動画が拡散され、知名度が向上した。
7,配送スピードの改善が顧客満足度を向上させた。
8,海外市場でも評価が高まっている。
9,競合製品と比べてコストパフォーマンスが優れている。
10,新製品の購買意欲が高まった理由は価格と品質のバランスが良いからだ。
11,ポイント還元制度が利用を促進している。
12,オンライン購入後の受け取り方法がわかりにくい。
13,サブスクリプションモデルが好評を博している。
14,ブランドの世界観がファンを形成している。
15,友人からの紹介で知ったというケースが多い。
16,広告の効果で購入動機が形成されたと回答したケースが多い。
17,SNSでの口コミがポジティブに広がっている。
18,配送スピードの改善が顧客満足度を向上させた。
19,在庫切れが頻発して機会損失につながっている。
20,ポイント還元制度が利用を促進している。
21,品質管理が徹底されている点が安心材料となっている。
22,価格改定により一部ユーザーが離反した。
23,価格が競合より高いが品質で差別化されている。
24,一部機能が期待通りに動作しない。
25,耐久テストで基準を満たしていることが確認された。
26,季節限定品がSNSで話題になっている。
27,インフルエンサーの紹介で購入が増えた。
28,パッケージデザインが古いという指摘がある。
29,配送の遅延が不満点として挙げられ、改善要望が集中している。
30,限定キャンペーンにより購買率が上昇した。
31,一部機能が期待通りに動作しない。
32,SNSでの口コミがポジティブに広がっている。
33,ブランドの世界観がファンを形成している。
34,味が濃すぎると感じたユーザーが一定数存在する。
35,プロモーション動画が拡散され、知名度が向上した。
36,店頭での実演が購買を促進している。
37,新機能の追加が購入意向を押し上げた。
38,キャンペーン告知後にSNSでの言及数が急増し、ブランド想起が向上した。
39,保証期間の延長が安心感を与えている。
40,保証期間の延長が安心感を与えている。
41,メディア露出が急増し、購買行動に影響を与えた。
42,新製品の購買意欲が高まった理由は価格と品質のバランスが良いからだ。
43,無料トライアルが有効に機能している。
44,新機能の追加が購入意向を押し上げた。
45,カスタマーサポートの丁寧さが評価されている。
46,広告の効果で購入動機が形成されたと回答したケースが多い。
47,メディア露出が急増し、購買行動に影響を与えた。
48,新製品の購買意欲が高まった理由は価格と品質のバランスが良いからだ。
49,新製品の購買意欲が高まった理由は価格と品質のバランスが良いからだ。
50,オンライン購入後の受け取り方法がわかりにくい。
